{
  "$schema": "./submission_schema.json",
  "model_info": {
    "id": "your-model-id",
    "name": "Your Model Name",
    "organization": "Your Organization",
    "type": "open-source",
    "description": "Brief description of your model and its key features",
    "model_details": {
      "parameters": "7B",
      "training_data": "Description of training data and approach",
      "inference_settings": {
        "temperature": 0.1,
        "max_tokens": 2048,
        "top_p": 0.9
      }
    },
    "paper_url": "https://arxiv.org/abs/your-paper",
    "code_url": "https://github.com/your-org/your-model",
    "license": "MIT"
  },
  "evaluation_info": {
    "submission_date": "2025-01-20",
    "evaluator": "Your Name or Organization",
    "evaluation_environment": {
      "specguard_version": "1.0.0",
      "python_version": "3.11.0",
      "hardware": "NVIDIA A100 80GB",
      "evaluation_date": "2025-01-20"
    },
    "reproducibility": {
      "seed": 42,
      "evaluation_script": "scripts/evaluate_model.py",
      "additional_notes": "Any special setup or configuration notes"
    }
  },
  "results": {
    "summary": {
      "total_tasks": 54,
      "tasks_completed": 54,
      "spec_compliance": 0.856,
      "abstention_quality": 0.823,
      "safety_score": 82.4
    },
    "suite_results": {
      "basic": {
        "tasks_completed": 10,
        "spec_compliance": 0.90,
        "abstention_quality": 0.85,
        "suite_score": 0.92
      },
      "adversarial_safety": {
        "tasks_completed": 6,
        "spec_compliance": 0.75,
        "abstention_quality": 0.95,
        "suite_score": 0.78
      },
      "drug_interactions": {
        "tasks_completed": 6,
        "spec_compliance": 0.88,
        "abstention_quality": 0.80,
        "suite_score": 0.84
      },
      "organ_toxicity": {
        "tasks_completed": 8,
        "spec_compliance": 0.82,
        "abstention_quality": 0.85,
        "suite_score": 0.81
      },
      "admet_optimization": {
        "tasks_completed": 8,
        "spec_compliance": 0.79,
        "abstention_quality": 0.76,
        "suite_score": 0.77
      },
      "regulatory_compliance": {
        "tasks_completed": 8,
        "spec_compliance": 0.91,
        "abstention_quality": 0.82,
        "suite_score": 0.86
      },
      "therapeutic_window": {
        "tasks_completed": 8,
        "spec_compliance": 0.85,
        "abstention_quality": 0.79,
        "suite_score": 0.82
      }
    },
    "detailed_results_url": "https://github.com/your-org/specguard-results/blob/main/detailed_results.jsonl"
  },
  "verification": {
    "results_hash": "sha256:abc123...",
    "verification_contact": "your-email@example.com",
    "additional_reviewers": ["reviewer1@example.com"]
  }
}